{
  "$schema": "https://json-schema.org/draft/2020-12/schema",
  "$id": "https://builders.kya-os.org/credentials/schema/attestation-v1.json",
  "title": "KYA-OS conformance attestation credential (v1)",
  "description": "A W3C VC 2.0 credential asserting one observed conformance test result: the named implementation, at the pinned code digest, passed the pinned suite. Deliberately no validUntil (additionalProperties: false forbids it): currency is judged against the published suite manifest, so supersession of the suite, not the passage of time, is what dates a credential. Structural validation in this repo is enforced by scripts/lib/shape.mjs - keep that module and this schema in sync.",
  "type": "object",
  "additionalProperties": false,
  "required": ["@context", "id", "type", "issuer", "validFrom", "credentialSchema", "credentialSubject", "credentialStatus", "termsOfUse", "proof"],
  "properties": {
    "@context": {
      "const": ["https://www.w3.org/ns/credentials/v2"]
    },
    "id": {
      "type": "string",
      "pattern": "^urn:kya:conf:[0-9a-f]{32}$",
      "description": "Deterministic id: urn:kya:conf: plus the first 32 hex of SHA-256 over 'kya-conf-id-v1' NUL subjectId NUL suiteVersion NUL vectorSetHash NUL level NUL scope NUL hex(sha256(JCS(categories or []))). Same claim inputs always yield the same id."
    },
    "type": {
      "const": ["VerifiableCredential", "KyaOsConformanceAttestation"]
    },
    "issuer": {
      "const": "did:web:builders.kya-os.org"
    },
    "validFrom": {
      "type": "string",
      "pattern": "^\\d{4}-\\d{2}-\\d{2}T\\d{2}:\\d{2}:\\d{2}Z$",
      "description": "Issuance instant, ISO 8601 UTC. There is deliberately no validUntil property anywhere in this schema."
    },
    "credentialSchema": {
      "type": "object",
      "additionalProperties": false,
      "required": ["id", "type"],
      "properties": {
        "id": { "const": "https://builders.kya-os.org/credentials/schema/attestation-v1.json" },
        "type": { "const": "JsonSchema" }
      }
    },
    "credentialSubject": {
      "type": "object",
      "additionalProperties": false,
      "required": ["id", "implementation", "level", "scope", "suite"],
      "properties": {
        "id": {
          "type": "string",
          "pattern": "^(https://|did:[a-z0-9]+:).+",
          "description": "The subject's canonical identifier: an https URL or a DID."
        },
        "implementation": {
          "type": "object",
          "additionalProperties": false,
          "required": ["name", "version", "digest"],
          "properties": {
            "name": { "type": "string", "minLength": 1, "maxLength": 80 },
            "version": { "type": "string", "minLength": 1, "maxLength": 64 },
            "repo": { "type": "string", "format": "uri", "pattern": "^https://" },
            "digest": {
              "type": "object",
              "additionalProperties": false,
              "required": ["gitCommit"],
              "properties": {
                "gitCommit": {
                  "type": "string",
                  "pattern": "^[0-9a-f]{40}$",
                  "description": "The exact commit the program re-ran. The credential attests this code state, not a moving branch."
                }
              }
            }
          }
        },
        "level": { "enum": ["L1", "L2", "L3"] },
        "scope": { "enum": ["full", "subset"] },
        "categories": {
          "type": "array",
          "minItems": 1,
          "uniqueItems": true,
          "items": { "type": "string", "pattern": "^[a-z0-9-]{2,40}$" },
          "description": "Vector categories the claim covers, sorted lexicographically. Required when scope is subset; forbidden when scope is full. A subset never renders as a bare level."
        },
        "suite": {
          "type": "object",
          "additionalProperties": false,
          "required": ["package", "packageVersion", "suiteVersion", "vectorSetHash", "vectorCount"],
          "properties": {
            "package": { "const": "@kya-os/mcp" },
            "packageVersion": { "type": "string", "pattern": "^\\d+\\.\\d+\\.\\d+(-[0-9A-Za-z.-]+)?$" },
            "suiteVersion": { "type": "string", "pattern": "^\\d+\\.\\d+\\.\\d+(-[0-9A-Za-z.-]+)?$" },
            "vectorSetHash": { "type": "string", "pattern": "^sha256:[0-9a-f]{64}$" },
            "vectorCount": { "type": "integer", "minimum": 1 }
          }
        }
      },
      "if": {
        "properties": { "scope": { "const": "subset" } },
        "required": ["scope"]
      },
      "then": { "required": ["categories"] },
      "else": { "not": { "required": ["categories"] } }
    },
    "credentialStatus": {
      "type": "array",
      "minItems": 2,
      "maxItems": 2,
      "prefixItems": [
        {
          "type": "object",
          "additionalProperties": false,
          "required": ["type", "statusPurpose", "statusListIndex", "statusListCredential"],
          "properties": {
            "type": { "const": "BitstringStatusListEntry" },
            "statusPurpose": { "const": "revocation" },
            "statusListIndex": { "type": "string", "pattern": "^(0|[1-9][0-9]*)$" },
            "statusListCredential": { "const": "https://builders.kya-os.org/credentials/status/revocation-1.json" }
          }
        },
        {
          "type": "object",
          "additionalProperties": false,
          "required": ["type", "statusPurpose", "statusListIndex", "statusListCredential"],
          "properties": {
            "type": { "const": "BitstringStatusListEntry" },
            "statusPurpose": { "const": "suspension" },
            "statusListIndex": { "type": "string", "pattern": "^(0|[1-9][0-9]*)$" },
            "statusListCredential": { "const": "https://builders.kya-os.org/credentials/status/suspension-1.json" }
          }
        }
      ],
      "items": false,
      "description": "Exactly two BitstringStatusListEntry objects, revocation then suspension, sharing one allocated index (the allocation ledger lives at registry/credentials/allocations.json)."
    },
    "termsOfUse": {
      "type": "array",
      "minItems": 1,
      "maxItems": 1,
      "items": {
        "type": "object",
        "additionalProperties": false,
        "required": ["type", "statement"],
        "properties": {
          "type": { "const": "KyaOsConformanceTerms" },
          "statement": { "type": "string", "minLength": 1 }
        }
      }
    },
    "proof": {
      "type": "object",
      "additionalProperties": false,
      "required": ["type", "cryptosuite", "created", "verificationMethod", "proofPurpose", "proofValue"],
      "properties": {
        "type": { "const": "DataIntegrityProof" },
        "cryptosuite": { "const": "eddsa-jcs-2022" },
        "created": { "type": "string", "pattern": "^\\d{4}-\\d{2}-\\d{2}T\\d{2}:\\d{2}:\\d{2}Z$" },
        "verificationMethod": {
          "type": "string",
          "pattern": "^did:web:builders\\.kya-os\\.org#conformance-issuer-[1-9][0-9]*$"
        },
        "proofPurpose": { "const": "assertionMethod" },
        "proofValue": { "type": "string", "pattern": "^z[1-9A-HJ-NP-Za-km-z]+$" }
      }
    }
  }
}
