{
  "@context": [
    "https://www.w3.org/ns/credentials/v2"
  ],
  "id": "urn:kya:conf:636af54c4ca34597c0a0460db3e1da14",
  "type": [
    "VerifiableCredential",
    "KyaOsConformanceAttestation"
  ],
  "issuer": "did:web:builders.kya-os.org",
  "validFrom": "2026-08-25T07:57:01Z",
  "credentialSchema": {
    "id": "https://builders.kya-os.org/credentials/schema/attestation-v1.json",
    "type": "JsonSchema"
  },
  "credentialSubject": {
    "id": "https://kya-os.org",
    "implementation": {
      "name": "@kya-os/mcp (reference implementation)",
      "version": "1.14.2",
      "repo": "https://github.com/decentralized-identity/kya-os-mcp",
      "digest": {
        "gitCommit": "8d9fc105fbbd197248a7d6f1f0828450bc326602"
      }
    },
    "level": "L3",
    "scope": "full",
    "suite": {
      "package": "@kya-os/mcp",
      "packageVersion": "1.14.2",
      "suiteVersion": "1.0.0",
      "vectorSetHash": "sha256:81d537d4574d3f66d651a03ca41c0b18493b67ea6f3e61aba47d1bda4f3cf49b",
      "vectorCount": 44
    }
  },
  "credentialStatus": [
    {
      "type": "BitstringStatusListEntry",
      "statusPurpose": "revocation",
      "statusListIndex": "0",
      "statusListCredential": "https://builders.kya-os.org/credentials/status/revocation-1.json"
    },
    {
      "type": "BitstringStatusListEntry",
      "statusPurpose": "suspension",
      "statusListIndex": "0",
      "statusListCredential": "https://builders.kya-os.org/credentials/status/suspension-1.json"
    }
  ],
  "termsOfUse": [
    {
      "type": "KyaOsConformanceTerms",
      "statement": "This credential asserts a test result: the named implementation, at the pinned code digest, passed the named conformance suite at the pinned suite version and vector-set hash. It deliberately carries no validUntil - currency is judged against the published suite manifest, so supersession of the suite, not the passage of time, is what dates it. It is not an endorsement, audit, warranty, or DIF certification."
    }
  ],
  "proof": {
    "type": "DataIntegrityProof",
    "cryptosuite": "eddsa-jcs-2022",
    "created": "2026-08-25T07:57:01Z",
    "verificationMethod": "did:web:builders.kya-os.org#conformance-issuer-1",
    "proofPurpose": "assertionMethod",
    "proofValue": "z4Qe9uXqcL237yGd5P6uX116o58cup4Sqog7sNfE6CJJfd9NK3FbGujZ6bPhddvmbAWtxuMczfz24VXA3pzW9HBfj"
  }
}
